{
  "$schema": "https://json-schema.org/draft/2020-12/schema",
  "$id": "config.schema.json",
  "title": "Evaluator config",
  "description": "Shared contract for evals/**/config.json. One living schema, referenced by each config via its $schema field. Strict: additionalProperties is false at every level, so any new field must be added here deliberately.",
  "type": "object",
  "additionalProperties": false,
  "required": ["$schema", "evaluator", "input_schema", "steps", "output_schema"],
  "properties": {
    "$schema": { "type": "string" },
    "evaluator": {
      "type": "object",
      "additionalProperties": false,
      "required": ["id", "stable_id", "name", "description", "supported_grades"],
      "properties": {
        "id": { "type": "string", "minLength": 1 },
        "stable_id": {
          "type": "string",
          "pattern": "^[0-9a-fA-F]{8}-[0-9a-fA-F]{4}-[0-9a-fA-F]{4}-[0-9a-fA-F]{4}-[0-9a-fA-F]{12}$",
          "description": "Permanent UUID, assigned once and never changed, even when `id` changes because the evaluator moves between taxonomy groupings."
        },
        "id_history": {
          "type": "array",
          "items": { "type": "string", "minLength": 1 },
          "description": "Every previous value of `id` for this `stable_id`, oldest first. Append the old `id` here whenever `id` changes -- this is what makes the id <-> stable_id mapping bidirectional and lookups possible in either direction."
        },
        "name": { "type": "string", "minLength": 1 },
        "description": { "type": "string", "minLength": 1 },
        "supported_grades": {
          "type": "array",
          "minItems": 1,
          "items": {
            "enum": ["K", "1", "2", "3", "4", "5", "6", "7", "8", "9", "10", "11", "12"]
          },
          "description": "The grades this evaluator is built for. Declared for every evaluator, including those that take no grade as input -- for those it is the only record of what the evaluator targets. This is NOT what validates a caller's grade: when the evaluator accepts one, `input_schema.properties.grade_level.enum` is the accepted set and the two must agree. Consumers validate against that enum, never against this field."
        }
      }
    },
    "input_schema": { "type": "object" },
    "output_schema": { "type": "object" },
    "outcome": {
      "type": "object",
      "additionalProperties": false,
      "required": ["score", "reasoning"],
      "properties": {
        "score": { "type": "string", "minLength": 1 },
        "reasoning": { "type": "string", "minLength": 1 }
      },
      "description": "Names the `output_schema` properties carrying the scalar verdict and its rationale, so consumers read one comparable value per evaluation instead of inferring which field holds it. Omitted by an evaluator whose output is not a single judgement."
    },
    "preprocessing": {
      "type": "array",
      "items": {
        "type": "object",
        "additionalProperties": false,
        "required": ["id", "type", "kind"],
        "dependentRequired": { "source_path": ["sha256"] },
        "properties": {
          "id": { "type": "string", "minLength": 1 },
          "type": { "enum": ["api", "computation"] },
          "kind": { "type": "string", "minLength": 1 },
          "description": { "type": "string" },
          "input": { "type": "string" },
          "output": { "type": "string" },
          "required_credentials": {
            "type": "array",
            "minItems": 1,
            "uniqueItems": true,
            "items": { "enum": ["learning_commons_api_key"] },
            "description": "Canonical config keys for non-LLM services this entry calls. LLM keys are not listed: those are derived from `model.provider`. Declared per entry so a step that does not run cannot demand a credential, and unaffected by a model override, which narrows only the LLM providers. `auth` names the header; this names what fills it."
          },
          "implementation": {
            "type": "object",
            "minProperties": 1,
            "additionalProperties": {
              "type": "object",
              "additionalProperties": false,
              "required": ["library", "function"],
              "properties": {
                "library": { "type": "string", "minLength": 1 },
                "function": { "type": "string", "minLength": 1 },
                "post_transform": {
                  "type": "object",
                  "additionalProperties": false,
                  "required": ["type"],
                  "properties": {
                    "type": { "enum": ["round"] },
                    "precision": { "type": "integer" }
                  }
                }
              }
            }
          },
          "endpoint": { "type": "string" },
          "params": { "type": "object" },
          "auth": { "type": "string" },
          "pagination": { "type": "string" },
          "source_path": {
            "type": "string",
            "minLength": 1,
            "description": "File this step loads, relative to the config. Declared so the path is part of the contract and the file can be checksum-verified like a prompt -- text reaching the model must not drift unnoticed."
          },
          "sha256": { "type": "string", "pattern": "^[a-f0-9]{64}$" },
          "condition": { "$ref": "#/$defs/Condition" }
        },
        "allOf": [
          {
            "if": { "properties": { "type": { "const": "api" } } },
            "then": { "required": ["endpoint", "params", "auth"] }
          },
          {
            "if": { "properties": { "type": { "const": "computation" } } },
            "then": { "required": ["implementation", "input", "output"] }
          }
        ]
      }
    },
    "steps": {
      "type": "array",
      "minItems": 1,
      "items": {
        "type": "object",
        "additionalProperties": false,
        "required": ["id", "type"],
        "properties": {
          "id": { "type": "string", "minLength": 1 },
          "type": { "enum": ["llm", "api"] },
          "required_credentials": {
            "type": "array",
            "minItems": 1,
            "uniqueItems": true,
            "items": { "enum": ["learning_commons_api_key"] },
            "description": "Canonical config keys for non-LLM services this entry calls. LLM keys are not listed: those are derived from `model.provider`. Declared per entry so a step that does not run cannot demand a credential, and unaffected by a model override, which narrows only the LLM providers. `auth` names the header; this names what fills it."
          },
          "optional": {
            "type": "boolean",
            "default": false,
            "description": "This step is dormant unless a caller opts in, so it is not part of the evaluator's default execution. Phase order and multi-provider model strings count non-optional steps only. Say in `description` what turns it on."
          },
          "description": { "type": "string" },
          "prompt": {
            "type": "object",
            "additionalProperties": false,
            "required": ["messages", "placeholders"],
            "properties": {
              "messages": {
                "type": "array",
                "minItems": 1,
                "items": {
                  "type": "object",
                  "additionalProperties": false,
                  "required": ["role", "source_path"],
                  "properties": {
                    "role": { "enum": ["system", "user", "assistant"] },
                    "source_path": { "type": "string", "minLength": 1 },
                    "sha256": { "type": "string", "pattern": "^[a-f0-9]{64}$" }
                  }
                }
              },
              "placeholders": {
                "type": "object",
                "additionalProperties": {
                  "type": "object",
                  "additionalProperties": false,
                  "required": ["required", "source"],
                  "properties": {
                    "required": { "type": "boolean" },
                    "source": {
                      "type": "string",
                      "pattern": "^(input|input\\.[A-Za-z_][A-Za-z0-9_]*|preprocessing\\.[A-Za-z_][A-Za-z0-9_]*|steps\\.[A-Za-z_][A-Za-z0-9_]*\\.output)$",
                      "description": "Where the value comes from. Exactly four forms: `input` (the caller input of the same name as the placeholder), `input.<field>` (a caller input under a different name), `preprocessing.<output>` (a preprocessing entry's declared `output` key, never its `id`), and `steps.<id>.output` (an earlier step's result). Constrained by pattern because an undeclared fifth form is unresolvable by any consumer."
                    },
                    "note": { "type": "string" }
                  }
                }
              }
            }
          },
          "model": {
            "type": "object",
            "additionalProperties": false,
            "required": ["provider", "name"],
            "properties": {
              "provider": { "enum": ["google", "openai", "anthropic"] },
              "name": { "type": "string", "minLength": 1 },
              "alias": { "type": "string" }
            }
          },
          "generation": {
            "type": "object",
            "additionalProperties": false,
            "required": ["temperature"],
            "properties": {
              "temperature": {
                "type": ["number", "null"],
                "minimum": 0,
                "maximum": 1,
                "description": "Sampling temperature to send, or null to omit the parameter entirely. Prefer an explicit number: the value an evaluator was validated at should be recorded, not inherited from a model default that can change under us. Use null only for models that reject any non-default value -- Claude Opus 4.7 and later return a 400 -- where omitting is the documented approach. A model recommending its default is not grounds for null; write the number out. Required rather than optional so every step records a deliberate choice; an absent key reads as 'nobody considered it'."
              }
            }
          },
          "parser": {
            "type": "object",
            "additionalProperties": false,
            "required": ["kind"],
            "properties": {
              "kind": { "const": "structured_output" }
            }
          },
          "attachments": {
            "type": "array",
            "minItems": 1,
            "uniqueItems": true,
            "items": {
              "type": "object",
              "additionalProperties": false,
              "required": ["input", "kind"],
              "properties": {
                "input": {
                  "type": "string",
                  "minLength": 1,
                  "description": "Name of an `input_schema` property whose value locates the file to attach. Not a placeholder: the input is never interpolated into prompt text."
                },
                "kind": { "enum": ["image"] }
              }
            },
            "description": "Non-text content parts the step attaches to its final user message, ahead of the text. Declared so a contract-driven runner in any SDK knows which input is a file to read and send rather than text to interpolate -- without this a runner would silently send the prompt alone. Bounds on the file (format, size) are declared on the input property itself."
          },
          "condition": { "$ref": "#/$defs/Condition" }
        },
        "allOf": [
          {
            "if": { "properties": { "type": { "const": "llm" } } },
            "then": { "required": ["prompt", "model", "parser", "generation"] }
          }
        ]
      }
    },
    "fixtures": {
      "type": "object",
      "additionalProperties": false,
      "properties": {
        "path": { "type": "string" },
        "tolerance": { "type": "object" }
      }
    }
  },
  "$defs": {
    "Condition": {
      "type": "object",
      "additionalProperties": false,
      "required": ["input", "in"],
      "properties": {
        "input": {
          "type": "string",
          "minLength": 1,
          "description": "Name of a runtime input field (as declared in input_schema.json) this condition tests."
        },
        "in": {
          "type": "array",
          "minItems": 1,
          "items": { "type": ["string", "number"] },
          "description": "This step/preprocessing entry only applies when the named input's value is one of these."
        }
      }
    }
  }
}
