{
  "$schema": "../../../_schemas/config.schema.json",
  "evaluator": {
    "id": "student_facing_text.ela_reading.background_knowledge_demands",
    "stable_id": "60ddf4c3-8425-40cc-bb42-a3975e20fd83",
    "id_history": ["subject-matter-knowledge"],
    "name": "Background Knowledge Demands Evaluator",
    "description": "Evaluates the extent of background knowledge a text assumes readers already have, relative to its target grade, producing a 4-level rubric rating distinguishing Common/Standard knowledge from Specialized/Theoretical knowledge.",
    "supported_grades": ["3", "4", "5", "6", "7", "8", "9", "10", "11", "12"]
  },
  "input_schema": {
    "$ref": "input_schema.json"
  },
  "preprocessing": [
    {
      "id": "fk_score",
      "type": "computation",
      "kind": "flesch_kincaid_grade",
      "description": "Compute the Flesch-Kincaid Grade Level for the input text and bind it to {fk_score} in the prompt.",
      "input": "text",
      "output": "fk_score",
      "implementation": {
        "python": {
          "library": "textstat",
          "function": "flesch_kincaid_grade",
          "post_transform": { "type": "round", "precision": 2 }
        },
        "typescript": {
          "library": "text-readability",
          "function": "fleschKincaidGrade",
          "post_transform": { "type": "round", "precision": 2 }
        }
      }
    }
  ],
  "steps": [
    {
      "id": "evaluate_background_knowledge_demands",
      "type": "llm",
      "description": "Single-call LLM step that produces the EvaluatorOutput JSON.",
      "prompt": {
        "messages": [
          {
            "role": "system",
            "source_path": "system.txt",
            "sha256": "d2ae1f5c760d010c576ca8a11878a7cc1ef25daa54c0a38ab77edb03cb0ad823"
          },
          {
            "role": "user",
            "source_path": "user.txt",
            "sha256": "cd8e6347db1a55d104e34436f8f66e833bd6583645d4786a554aaefdd26479b2"
          }
        ],
        "placeholders": {
          "text": {
            "required": true,
            "source": "input"
          },
          "grade_level": {
            "required": true,
            "source": "input"
          },
          "fk_score": {
            "required": true,
            "source": "preprocessing.fk_score"
          }
        }
      },
      "model": {
        "provider": "google",
        "name": "gemini-3-flash-preview"
      },
      "generation": {
        "temperature": null
      },
      "parser": {
        "kind": "structured_output"
      }
    }
  ],
  "output_schema": {
    "$ref": "output_schema.json"
  },
  "fixtures": {
    "path": "fixtures.json",
    "tolerance": {
      "allow_adjacent_levels": true,
      "notes": "If allow_adjacent_levels is true, predictions within one rubric step of the expected label count as a pass."
    }
  }
}
