{
  "$schema": "../../../_schemas/config.schema.json",
  "evaluator": {
    "id": "text_complexity.ela_reading.vocabulary_complexity",
    "stable_id": "d6f8e6d1-3d0d-4b6c-9a3a-2b7c9e6f1a4d",
    "id_history": [
      "vocabulary"
    ],
    "name": "Vocabulary Complexity Evaluator",
    "description": "Evaluates the complexity of a text's vocabulary relative to its target grade. Grades 3-4 and grades 5-12 use genuinely different prompts, models, and preprocessing, so the vocab_complexity step has two variants selected by the grade_level input via each variant's condition -- see vocab_complexity_grades_3_4 and vocab_complexity_other_grades below.",
    "supported_grades": [
      "3",
      "4",
      "5",
      "6",
      "7",
      "8",
      "9",
      "10",
      "11",
      "12"
    ]
  },
  "input_schema": {
    "$ref": "input_schema.json"
  },
  "preprocessing": [
    {
      "id": "fk_score",
      "type": "computation",
      "kind": "flesch_kincaid_grade",
      "description": "Compute the Flesch-Kincaid Grade Level for the input text and bind it to {fk_score} in the prompt. Only the grades-3-4 branch uses it.",
      "input": "text",
      "output": "fk_score",
      "condition": {
        "input": "grade_level",
        "in": [
          "3",
          "4"
        ]
      },
      "implementation": {
        "python": {
          "library": "textstat",
          "function": "flesch_kincaid_grade",
          "post_transform": {
            "type": "round",
            "precision": 2
          }
        },
        "typescript": {
          "library": "text-readability",
          "function": "fleschKincaidGrade",
          "post_transform": {
            "type": "round",
            "precision": 2
          }
        }
      }
    }
  ],
  "steps": [
    {
      "id": "background_knowledge",
      "type": "llm",
      "description": "Generates a short assumption about what students at the target grade already know about the text's topic. Runs before vocab_complexity and feeds it {student_background_knowledge}. Shared by both grade-band branches -- no condition, always runs.",
      "prompt": {
        "messages": [
          {
            "role": "user",
            "source_path": "background-knowledge.txt",
            "sha256": "d94ba33dd22b3ef75165ef916546326a1d9db1890d77e422804aa4c0f073ebd9"
          }
        ],
        "placeholders": {
          "text": {
            "required": true,
            "source": "input"
          },
          "grade_level": {
            "required": true,
            "source": "input"
          }
        }
      },
      "model": {
        "provider": "openai",
        "name": "gpt-4o-2024-11-20"
      },
      "generation": {
        "temperature": 0
      },
      "parser": {
        "kind": "structured_output"
      }
    },
    {
      "id": "vocab_complexity_grades_3_4",
      "type": "llm",
      "description": "Grades 3-4 vocabulary complexity rating, using a rubric-based prompt validated specifically for this grade band.",
      "condition": {
        "input": "grade_level",
        "in": [
          "3",
          "4"
        ]
      },
      "prompt": {
        "messages": [
          {
            "role": "system",
            "source_path": "grades-3-4-system.txt",
            "sha256": "82f1338464ad4deb2689619bb341092ff06570fb80c2e40c85c75957edc3f22c"
          },
          {
            "role": "user",
            "source_path": "grades-3-4-user.txt",
            "sha256": "78217aef5e4c232eb4bdabf91238cf8970d4001ebbfb894792aa790fdebc4916"
          }
        ],
        "placeholders": {
          "text": {
            "required": true,
            "source": "input"
          },
          "grade_level": {
            "required": true,
            "source": "input.grade_level"
          },
          "student_background_knowledge": {
            "required": true,
            "source": "steps.background_knowledge.output"
          },
          "fk_score": {
            "required": true,
            "source": "preprocessing.fk_score"
          }
        }
      },
      "model": {
        "provider": "google",
        "name": "gemini-2.5-pro"
      },
      "generation": {
        "temperature": 0
      },
      "parser": {
        "kind": "structured_output"
      }
    },
    {
      "id": "vocab_complexity_other_grades",
      "type": "llm",
      "description": "Grades 5-12 vocabulary complexity rating, using an annotation-guide-and-rubric prompt with worked exemplars. NOTE: this step's own system.txt final line instructs the model to 'use only a single integer... don't include any other text' -- a real, verified contradiction with this contract's required JSON object (confirmed against a captured real GPT-4.1 response, sdks/settings/vocabulary/contracts.toml cases.hurricanes_grade7, which returned the full object and ignored the integer instruction). Left unedited per maintainer direction; structured output enforces this step's actual contract regardless of that prose.",
      "condition": {
        "input": "grade_level",
        "in": [
          "5",
          "6",
          "7",
          "8",
          "9",
          "10",
          "11",
          "12"
        ]
      },
      "prompt": {
        "messages": [
          {
            "role": "system",
            "source_path": "other-grades-system.txt",
            "sha256": "b23c7c976168499dd5d81fcfd869d08b825cfb298817679bb1192d05b923720a"
          },
          {
            "role": "user",
            "source_path": "other-grades-user.txt",
            "sha256": "c62bd4d594f6ac755829733c5526e16acdc175e17503b1b9b70aabdf33a891de"
          }
        ],
        "placeholders": {
          "text": {
            "required": true,
            "source": "input"
          },
          "grade_level": {
            "required": true,
            "source": "input.grade_level"
          },
          "student_background_knowledge": {
            "required": true,
            "source": "steps.background_knowledge.output"
          }
        }
      },
      "model": {
        "provider": "openai",
        "name": "gpt-4.1-2025-04-14"
      },
      "generation": {
        "temperature": 0
      },
      "parser": {
        "kind": "structured_output"
      }
    }
  ],
  "output_schema": {
    "$ref": "output_schema.json"
  },
  "outcome": {
    "score": "complexity_score",
    "reasoning": "reasoning"
  },
  "fixtures": {
    "path": "fixtures.json"
  }
}
