{
  "$schema": "../../../../_schemas/config.schema.json",
  "evaluator": {
    "id": "student_facing_text.ela_reading.vocabulary_other_grades",
    "stable_id": "f600e7c3-6302-45d5-a27e-e44252d2b7d5",
    "id_history": ["literacy.ela_reading.vocabulary_other_grades"],
    "name": "Vocabulary Evaluator (Grades 5-12)",
    "description": "Evaluates the complexity of a text's vocabulary relative to grades 5-12, using an annotation-guide-and-rubric prompt with worked exemplars. Grades 3-4 use a different prompt, model and config: evals/student-facing-text/ela-reading/vocabulary/grades-3-4/. Unlike grades-3-4, this rubric does not use Flesch-Kincaid at all -- no {fk_score} placeholder exists in system.txt/user.txt.",
    "supported_grades": ["5", "6", "7", "8", "9", "10", "11", "12"]
  },
  "input_schema": {
    "$ref": "input_schema.json"
  },
  "preprocessing": [],
  "steps": [
    {
      "id": "background_knowledge",
      "type": "llm",
      "description": "Generates a short assumption about what students at the target grade already know about the text's topic. Runs before vocab_complexity and feeds it {student_background_knowledge}. This prompt is shared with the grades-3-4 path: ../background-knowledge.txt.",
      "prompt": {
        "messages": [
          {
            "role": "user",
            "source_path": "../background-knowledge.txt",
            "sha256": "0128ab093be45401655231a1a9f27a4b1dc1142d2422a71976da3eee65ee8a18"
          }
        ],
        "placeholders": {
          "text": {
            "required": true,
            "source": "input"
          },
          "grade_level": {
            "required": true,
            "source": "input"
          }
        }
      },
      "model": {
        "provider": "openai",
        "name": "gpt-4o-2024-11-20"
      },
      "generation": {
        "temperature": 0
      },
      "parser": {
        "kind": "structured_output"
      }
    },
    {
      "id": "vocab_complexity",
      "type": "llm",
      "description": "NOTE 1: this step's own system.txt final line instructs the model to 'use only a single integer... don't include any other text' -- a real, verified contradiction with this contract's required JSON object (confirmed against a captured real GPT-4.1 response, sdks/settings/vocabulary/contracts.toml cases.hurricanes_grade7, which returned the full object and ignored the integer instruction). Left unedited per maintainer direction; structured output enforces this step's actual contract regardless of that prose. (Previously this line lived in user.txt; it moved to system.txt when this evaluator's prompts were standardized so system.txt carries all instructions and user.txt carries only inputs -- the contradiction itself is unchanged.) NOTE 2: scripts/check.py's eval-config check currently only validates steps[0]'s prompt files (sha256 + placeholder sync) -- see scripts/checks/eval_config.py:_prompt(). This step's system.txt/user.txt are NOT covered by that check today.",
      "prompt": {
        "messages": [
          {
            "role": "system",
            "source_path": "system.txt",
            "sha256": "632025189d29343860ba8299e79906a7fd8afc651f5e40282d9c5eb356f9ed1c"
          },
          {
            "role": "user",
            "source_path": "user.txt",
            "sha256": "b383d7a77a3640326cee4d58a248118e62af0aca39990d31546db07c12986708"
          }
        ],
        "placeholders": {
          "text": {
            "required": true,
            "source": "input"
          },
          "grade_level": {
            "required": true,
            "source": "input.grade_level"
          },
          "student_background_knowledge": {
            "required": true,
            "source": "steps.background_knowledge.output"
          }
        }
      },
      "model": {
        "provider": "openai",
        "name": "gpt-4.1"
      },
      "generation": {
        "temperature": 0
      },
      "parser": {
        "kind": "structured_output"
      }
    }
  ],
  "output_schema": {
    "$ref": "output_schema.json"
  },
  "fixtures": {
    "path": "fixtures.json"
  }
}
