{
  "$schema": "../../../_schemas/config.schema.json",
  "evaluator": {
    "id": "student_facing_text.ela_reading.reference_knowledge_demands",
    "stable_id": "b52b1924-73b7-40e3-bbca-081302c83f30",
    "id_history": ["literacy.gla.intertextuality"],
    "name": "Reference Knowledge Demands Evaluator",
    "description": "Evaluates the Reference Knowledge Demands (intertextuality) dimension of qualitative text complexity for grades 3-12 reading assessment, producing a 4-level rubric rating with structured pedagogical detail.",
    "supported_grades": ["3", "4", "5", "6", "7", "8", "9", "10", "11", "12"]
  },
  "input_schema": {
    "$ref": "input_schema.json"
  },
  "preprocessing": [
    {
      "id": "fk_score",
      "type": "computation",
      "kind": "flesch_kincaid_grade",
      "description": "Compute the Flesch-Kincaid Grade Level for the input text and bind it to {fk_score} in the prompt.",
      "input": "text",
      "output": "fk_score",
      "implementation": {
        "python": {
          "library": "textstat",
          "function": "flesch_kincaid_grade",
          "post_transform": { "type": "round", "precision": 2 }
        },
        "typescript": {
          "library": "text-readability",
          "function": "fleschKincaidGrade",
          "post_transform": { "type": "round", "precision": 2 }
        }
      }
    }
  ],
  "steps": [
    {
      "id": "evaluate_reference_knowledge_demands",
      "type": "llm",
      "description": "Single-call LLM step that produces the EvaluatorOutput JSON.",
      "prompt": {
        "messages": [
          {
            "role": "system",
            "source_path": "system.txt",
            "sha256": "30302fe959ada9f3d78753c249396cd65245437dc54d5e17b0256152f2802908"
          },
          {
            "role": "user",
            "source_path": "user.txt",
            "sha256": "cd8e6347db1a55d104e34436f8f66e833bd6583645d4786a554aaefdd26479b2"
          }
        ],
        "placeholders": {
          "text": {
            "required": true,
            "source": "input"
          },
          "grade_level": {
            "required": true,
            "source": "input"
          },
          "fk_score": {
            "required": true,
            "source": "preprocessing.fk_score"
          }
        }
      },
      "model": {
        "provider": "google",
        "name": "gemini-3-flash-preview",
        "alias": "intertextuality-evaluator-default"
      },
      "generation": {
        "temperature": 0
      },
      "parser": {
        "kind": "structured_output"
      }
    }
  ],
  "output_schema": {
    "$ref": "output_schema.json"
  },
  "outcome": {
    "score": "complexity_score",
    "reasoning": "reasoning"
  },
  "fixtures": {
    "path": "fixtures.json",
    "tolerance": {
      "allow_adjacent_levels": true,
      "notes": "If allow_adjacent_levels is true, predictions within one rubric step of the expected label count as a pass."
    }
  }
}
