{
  "$schema": "../../../_schemas/config.schema.json",
  "evaluator": {
    "id": "durable_skills.ela_writing.critical_thinking",
    "stable_id": "114fb24f-65d8-4736-bb23-300b0470fc4d",
    "name": "Critical Thinking Evaluator",
    "description": "Rates grade 8-10 student argumentative essays for Critical Thinking across five indicators (synthesizing sources, evidence strength, counterarguments, facts over opinions, drawing conclusions) plus an Overall rating, on a five-level scale (not_evident to extending).",
    "supported_grades": [
      "8",
      "9",
      "10"
    ]
  },
  "input_schema": {
    "$ref": "input_schema.json"
  },
  "preprocessing": [
    {
      "id": "count_source_passages",
      "type": "computation",
      "kind": "length",
      "description": "How many source passages the caller passed. Counted from the list before it is rendered as markdown, and bound into the prompt as {source_count}.",
      "input": "source_passages",
      "output": "source_count",
      "implementation": {
        "python": {
          "library": "builtins",
          "function": "len"
        },
        "typescript": {
          "library": "builtins",
          "function": "length"
        }
      }
    }
  ],
  "steps": [
    {
      "id": "evaluate_critical_thinking",
      "type": "llm",
      "description": "Single-call LLM step producing per-indicator ratings (evidence + rationale before each rating) and the Overall rating last.",
      "prompt": {
        "messages": [
          {
            "role": "system",
            "source_path": "system.txt",
            "sha256": "4a04db87ac1343c955b0f1a7152b720825e8ce671e2c3e7d41f55d3c7eba5914"
          },
          {
            "role": "user",
            "source_path": "user.txt",
            "sha256": "0803f5b11a28d431c8c7071534523a022b48e325e37f5956ffd00278137a5ade"
          }
        ],
        "placeholders": {
          "source_count": {
            "required": true,
            "source": "preprocessing.source_count"
          },
          "assignment_text": {
            "required": true,
            "source": "input"
          },
          "sources": {
            "required": true,
            "source": "input.source_passages"
          },
          "essay_text": {
            "required": true,
            "source": "input"
          }
        }
      },
      "model": {
        "provider": "anthropic",
        "name": "claude-opus-5"
      },
      "generation": {
        "temperature": null
      },
      "parser": {
        "kind": "structured_output"
      }
    }
  ],
  "output_schema": {
    "$ref": "output_schema.json"
  },
  "outcome": {
    "score": "critical_thinking_score",
    "reasoning": "reasoning"
  },
  "fixtures": {
    "path": "fixtures.json",
    "tolerance": {
      "allow_adjacent_levels": true,
      "notes": "If allow_adjacent_levels is true, predictions within one rubric step of the expected label count as a pass. Not Evident < Exploring < Analyzing < Integrating < Extending."
    }
  }
}
