{
  "$schema": "../../../_schemas/config.schema.json",
  "evaluator": {
    "id": "feedback.ela_writing.strength_acknowledgement",
    "stable_id": "99370b62-6791-4535-a77e-dda6806c635c",
    "id_history": [
      "feedback.productive_coaching_writing_feedback.is_acknowledges_strength"
    ],
    "name": "Strength Acknowledgement Evaluator",
    "description": "Does the feedback identify what the student did well?",
    "supported_grades": [
      "8",
      "9"
    ]
  },
  "input_schema": {
    "$ref": "input_schema.json"
  },
  "preprocessing": [],
  "steps": [
    {
      "id": "evaluate_strength_acknowledgement",
      "type": "llm",
      "description": "Single-call LLM step that produces the binary EvaluatorOutput JSON.",
      "prompt": {
        "messages": [
          {
            "role": "system",
            "source_path": "system.txt",
            "sha256": "3a96d9313c95f5dfdbd3f2f4208f7bd308a553133c89ed2831dc9aa06170e17d"
          },
          {
            "role": "user",
            "source_path": "user.txt",
            "sha256": "eaac7e6eadcc43716e4a98b9e7f34c493c1cbe46adb38367dd8697b904d11bfa"
          }
        ],
        "placeholders": {
          "student_text": {
            "required": true,
            "source": "input"
          },
          "feedback_text": {
            "required": true,
            "source": "input"
          }
        }
      },
      "model": {
        "provider": "openai",
        "name": "gpt-5.4-2026-03-05"
      },
      "generation": {
        "temperature": 1
      },
      "parser": {
        "kind": "structured_output"
      }
    }
  ],
  "output_schema": {
    "$ref": "output_schema.json"
  },
  "fixtures": {
    "path": "fixtures.json"
  }
}
